<?xml version="1.0" encoding="utf-8" ?>
<enemies xmlns="http://gamebooks.zagor.hu" xmlns:xsi="http://www.w3.org/2001/XMLSchema-instance" xsi:schemaLocation="http://gamebooks.zagor.hu http://zagor.hu/xsd/ff-enemies.xsd">
  <enemy name="Tolvaj" id="1" stamina="6" skill="7" />
  <enemy name="Első Denevér" id="2" stamina="7" skill="5" />
  <enemy name="Második Denevér" id="3" stamina="6" skill="6" />
  <enemy name="Xlaia" id="4" stamina="7" skill="8" />
  <enemy name="Fényimádók" id="5" stamina="11" skill="9" />
  <enemy name="Hobgoblin" id="6" stamina="8" skill="7" />
  <enemy name="Óriáspók" id="7" stamina="5" skill="9" />
  <enemy name="Első Ork" id="8" stamina="6" skill="5" />
  <enemy name="Második Ork" id="9" stamina="5" skill="6" />
  <enemy name="Első Sündisznó" id="10" stamina="5" skill="7" staminaDamage="3" />
  <enemy name="Második Sündisznó" id="11" stamina="5" skill="8" staminaDamage="3" />
  <enemy name="Törpe" id="12" stamina="5" skill="8" />
  <enemy name="Tükörkép" id="13" stamina="99" skill="99"/>
  <enemy name="Galon" id="14" stamina="8" skill="12"/>
  <enemy name="Iszapsárkány" id="15" stamina="5" skill="9"/>
  <enemy name="Iszapsárkány" id="16" stamina="6" skill="10"/>
  <enemy name="Első Iszapsárkány" id="17" stamina="5" skill="9"/>
  <enemy name="Második Iszapsárkány" id="18" stamina="6" skill="10"/>
  

</enemies>
