<?xml version="1.0" encoding="utf-8" ?>
<enemies xmlns="http://gamebooks.zagor.hu" xmlns:xsi="http://www.w3.org/2001/XMLSchema-instance" xsi:schemaLocation="http://gamebooks.zagor.hu http://zagor.hu/xsd/ff-enemies.xsd">
  <enemy id="1" name="Első Városi Őr" skill="7" stamina="4" />
  <enemy id="2" name="Második Városi Őr" skill="6" stamina="6" />
  <enemy id="3" name="Nomád Kereskedő" skill="5" stamina="6" />
  <enemy id="4" name="Első Hobgoblin" skill="6" stamina="6" />
  <enemy id="5" name="Második Hobgoblin" skill="5" stamina="7" />
  <enemy id="6" name="Első Hobgoblin" skill="7" stamina="4" />
  <enemy id="7" name="Második Hobgoblin" skill="6" stamina="6" />
  <enemy id="8" name="Harmadik Hobgoblin" skill="7" stamina="5" />
  <enemy id="9" name="Negyedik Hobgoblin" skill="6" stamina="4" />
  <enemy id="10" name="Thoul" skill="9" stamina="7" />
  <enemy id="11" name="Mágus-Kormányzó" skill="10" stamina="12" />
  <enemy id="12" name="Goblin" skill="7" stamina="6" />
  <enemy id="13" name="Gnoll" skill="8" stamina="4" />
  <enemy id="14" name="Gyíkember" skill="7" stamina="7" />
  <enemy id="15" name="Első Hobgoblin Őr" skill="6" stamina="6" />
  <enemy id="16" name="Második Hobgoblin Őr" skill="5" stamina="7" />
  <enemy id="17" name="Éjghoul" skill="8" stamina="7" />
  <enemy id="18" name="Harci Macska" skill="9" stamina="8" />
  <enemy id="19" name="Lauper" skill="10" stamina="6" />
  <enemy id="20" name="Sziklabéka" skill="8" stamina="6" />
  <enemy id="21" name="Harci Macska" skill="9" stamina="8" />
  <enemy id="22" name="Lauper" skill="10" stamina="6" />
  <enemy id="23" name="Első Lauper" skill="6" stamina="6" />
  <enemy id="24" name="Harci Macska" skill="8" stamina="7" />
  <enemy id="25" name="Második Lauper" skill="9" stamina="5" />
  <enemy id="26" name="Első Lauper" skill="7" stamina="5" />
  <enemy id="27" name="Második Lauper" skill="6" stamina="6" />
  <enemy id="28" name="Lauper" skill="7" stamina="6" />
  <enemy id="29" name="Első Gyíkember" skill="8" stamina="8" />
  <enemy id="30" name="Második Gyíkember" skill="9" stamina="8" />
  <enemy id="31" name="Harmadik Gyíkember" skill="8" stamina="7" />
  <enemy id="32" name="Első Bogármedve Őr" skill="8" stamina="8" />
  <enemy id="33" name="Második Bogármedve Őr" skill="8" stamina="9" />
  <enemy id="34" name="Gyíkember" skill="8" stamina="6" />
  <enemy id="35" name="Bronzgólem" skill="10" stamina="9" staminaDamageWhenHit="1" />
  <enemy id="36" name="Bronzgólem" skill="11" stamina="9" staminaDamageWhenHit="1" />
  <enemy id="37" name="Lauper" skill="7" stamina="7" />
  <enemy id="38" name="Ork" skill="7" stamina="6" />
  <enemy id="39" name="Első Nomád" skill="6" stamina="5" />
  <enemy id="40" name="Második Nomád" skill="5" stamina="6" />
  <enemy id="41" name="Bogármedve" skill="9" stamina="7" />
  <enemy id="42" name="Első Goblin" skill="5" stamina="5" />
  <enemy id="43" name="Második Goblin" skill="5" stamina="4" />
  <enemy id="44" name="Tűzóriás" skill="12" stamina="18" />
  <enemy id="45" name="Óriás Karvaly" skill="9" stamina="9" />
  <enemy id="46" name="Óriás Ölyv" skill="10" stamina="12" />
  <enemy id="47" name="Kígyók" skill="6" stamina="6" staminaDamage="4" />
  <enemy id="48" name="Dervis" skill="7" stamina="6" />
  <enemy id="49" name="Első Karolópók" skill="5" stamina="7" />
  <enemy id="50" name="Második Karolópók" skill="7" stamina="6" />


</enemies>
