<?xml version="1.0" encoding="utf-8" ?>
<enemies xmlns="http://gamebooks.zagor.hu" xmlns:xsi="http://www.w3.org/2001/XMLSchema-instance" xsi:schemaLocation="http://gamebooks.zagor.hu http://zagor.hu/xsd/ff-enemies.xsd">
  <enemy stamina="7" skill="7" id="1" name="Első Kaméleonita" />
  <enemy stamina="6" skill="6" id="2" name="Második Kaméleonita" />
  <enemy stamina="6" skill="7" id="3" name="Harmadik Kaméleonita" />
  <enemy stamina="5" skill="10" id="4" name="Első Rad-Hulk" />
  <enemy stamina="6" skill="10" id="5" name="Második Rad-Hulk" />
  <enemy stamina="5" skill="6" id="6" name="Ork" />
  <enemy stamina="5" skill="6" id="7" name="Első Ork" />
  <enemy stamina="6" skill="6" id="8" name="Második Ork" />
  <enemy stamina="5" skill="6" id="9" name="Harmadik Ork" />
  <enemy stamina="6" skill="6" id="10" name="Első Ork" />
  <enemy stamina="5" skill="6" id="11" name="Második Ork" />
  <enemy stamina="9" skill="8" id="12" name="Farkasember" />
  <enemy stamina="6" skill="5" id="13" name="Csontok Őrzője" />
  <enemy stamina="5" skill="5" id="14" name="Első Goblin" />
  <enemy stamina="6" skill="5" id="15" name="Második Goblin" />
  <enemy stamina="5" skill="6" id="16" name="Harmadik Goblin" />
  <enemy stamina="6" skill="6" id="17" name="Negyedik Goblin" />
  <enemy stamina="4" skill="5" id="18" name="Első Óriás Tűzbogár" />
  <enemy stamina="4" skill="5" id="19" name="Második Óriás Tűzbogár" />
  <enemy stamina="10" skill="9" id="20" name="Erdei Démon" />
  <enemy stamina="10" skill="10" id="21" name="Griffin" />
  <enemy stamina="9" skill="8" id="22" name="Agyaggólem" />
  <enemy stamina="9" skill="8" id="23" name="Farkasember" />
  <enemy stamina="10" skill="10" id="24" name="Kentaur" />
  <enemy stamina="10" skill="9" id="25" name="Dombi Óriás" />
  <enemy stamina="5" skill="6" id="26" name="Vad Dombi Ember" />
  <enemy stamina="6" skill="5" id="27" name="Démoni Szolga" />
  <enemy stamina="6" skill="6" id="28" name="Démonivadék" killableByNormal="false" />
  <enemy stamina="7" skill="8" id="29" name="Majomember" fleeAtRound="3" />
  <enemy stamina="5" skill="6" id="30" name="Első Csontváz" />
  <enemy stamina="6" skill="6" id="31" name="Második Csontváz" />
  <enemy stamina="6" skill="5" id="32" name="Harmadik Csontváz" />
  <enemy stamina="7" skill="7" id="33" name="Törpe" />
  <enemy stamina="5" skill="4" id="34" name="Vasevő" staminaDamage="0" skillDamage="1" />
  <enemy stamina="9" skill="9" id="35" name="Első Doragar" />
  <enemy stamina="10" skill="9" id="36" name="Második Doragar" />
  <enemy stamina="9" skill="8" id="37" name="Barlangi Troll" />
  <enemy stamina="24" skill="12" id="38" name="Gargantis" />
  <enemy stamina="6" skill="5" id="39" name="Patkányember" />
  <enemy stamina="4" skill="5" id="40" name="Vámpír Denevér" />
  <enemy stamina="6" skill="7" id="41" name="Vad Elf" />
  <enemy stamina="7" skill="8" id="42" name="Démoni Szolga" />
  <enemy stamina="8" skill="8" id="43" name="Pokolfenevad" />
  <enemy stamina="4" skill="6" id="44" name="Első Láva Démon" />
  <enemy stamina="4" skill="5" id="45" name="Második Láva Démon" />
  <enemy stamina="4" skill="6" id="46" name="Harmadik Láva Démon" />
  <enemy stamina="6" skill="6" id="47" name="Zombi" />
  <enemy stamina="20" skill="12" id="48" name="Razaak" />



  <enemy stamina="10" skill="10" id="101" name="Symm" startAtRound="0" />
  <enemy stamina="10" skill="9" id="102" name="Borri" startAtRound="0" />

</enemies>
