<?xml version="1.0" encoding="utf-8" ?>
<enemies xmlns="http://gamebooks.zagor.hu" xmlns:xsi="http://www.w3.org/2001/XMLSchema-instance" xsi:schemaLocation="http://gamebooks.zagor.hu http://zagor.hu/xsd/ff-enemies.xsd">
  <enemy name="Ice Warrior" id="1" stamina="8" skill="7" />
  <enemy name="Macra" id="2" stamina="12" skill="8" staminaDamage="3" />
  <enemy name="Granzork" id="3" stamina="10" skill="7" />
  <enemy name="Astromancer" id="4" stamina="6" skill="9" fleeAtRound="2" />
  <enemy name="Dinosaur" id="5" stamina="16" skill="7" />
  <enemy name="Man" id="6" stamina="12" skill="9" />
  <enemy name="Zombie" id="7" stamina="7" skill="6" />
  <enemy name="Imp" id="8" stamina="5" skill="10" />
  <enemy name="Creepers" id="9" stamina="4" skill="7" staminaDamage="0" staminaAutoDamage="2" />
  <enemy name="Forest Demon" id="10" stamina="8" skill="8" />
  <enemy name="Crystal Statue" id="11" stamina="9" skill="9" damageAbsorption="1" />
  <enemy name="First Walking Mouth" id="12" stamina="7" skill="7" />
  <enemy name="Second Walking Mouth" id="13" stamina="7" skill="7" />
  <enemy name="Sand Squid" id="14" stamina="9" skill="8" />
  <enemy name="Devil Hound" id="15" stamina="8" skill="7" fleeAtRound="4" />
  <enemy name="Hound-Master" id="19" stamina="10" skill="8" />
  <enemy name="Traskannd" id="20" stamina="14" skill="11" fleeAtRound="2" />
  <enemy name="Denrec" id="21" stamina="2" skill="9" />
  <enemy name="Hand" id="22" stamina="2" skill="11" fleeAtRound="3" />
  <enemy name="Anakendis" id="23" stamina="20" skill="12" killableByNormal="false" />
  <enemy name="Anakendis" id="24" stamina="20" skill="12" killableByNormal="false" fleeAtRound="2" />
  <enemy name="Anakendis" id="25" stamina="14" skill="8" />
</enemies>
