<?xml version="1.0" encoding="utf-8" ?>
<enemies xmlns="http://gamebooks.zagor.hu" xmlns:xsi="http://www.w3.org/2001/XMLSchema-instance" xsi:schemaLocation="http://gamebooks.zagor.hu http://zagor.hu/xsd/ff-enemies.xsd">
  <enemy id="1" name="Ork" skill="6" stamina="5" />
  <enemy id="2" name="Ork" skill="6" stamina="4" />
  <enemy id="3" name="Kígyó" skill="5" stamina="2" />
  <enemy stamina="4" skill="5" id="4" name="Első Ork" />
  <enemy stamina="5" skill="5" id="5" name="Második Ork" />
  <enemy stamina="6" skill="7" id="6" name="Ork Törzsfőnök" />
  <enemy stamina="3" skill="7" id="7" name="Szolga" />
  <enemy stamina="5" skill="5" id="8" name="Első Goblin" />
  <enemy stamina="6" skill="5" id="9" name="Második Goblin" />
  <enemy stamina="4" skill="6" id="10" name="Első Ork" />
  <enemy stamina="3" skill="5" id="11" name="Második Ork" />
  <enemy stamina="4" skill="6" id="12" name="Harmadik Ork" />
  <enemy stamina="2" skill="5" id="13" name="Negyedik Ork" />
  <enemy stamina="4" skill="4" id="14" name="Ötödik Ork" />
  <enemy id="15" name="Ogre" skill="8" stamina="10" />
  <enemy id="16" name="Szárnyas Gremlin" skill="5" stamina="7" />
  <enemy stamina="4" skill="6" id="17" name="Kéz" />
  <enemy stamina="7" skill="7" id="18" name="Óriás Homokhernyó" />
  <enemy id="19" name="Troll" skill="8" stamina="8" />
  <enemy stamina="4" skill="5" id="20" name="Első Patkány" />
  <enemy stamina="3" skill="6" id="21" name="Második Patkány" />
  <enemy stamina="5" skill="5" id="22" name="Harmadik Patkány" />
  <enemy stamina="9" skill="8" id="23" name="Óriás" />
  <enemy stamina="10" skill="10" id="24" name="Vas Küklopsz" />
  <enemy stamina="6" skill="7" id="25" name="Barbár" />
  <enemy stamina="8" skill="7" id="26" name="Óriás Pók" />
  <enemy stamina="6" skill="7" id="27" name="Első Ősember" />
  <enemy stamina="4" skill="6" id="28" name="Második Ősember" />
  <enemy stamina="6" skill="6" id="29" name="Denevérek" />
  <enemy stamina="5" skill="8" id="30" name="Patkányember" resurrectable="true" />
  <enemy stamina="6" skill="7" id="31" name="Krokodil" fleeAtRound="2" />
  <enemy stamina="5" skill="5" id="32" name="Piranhák" resurrectable="true" />
  <enemy stamina="1" skill="5" id="33" name="Piranhák" resurrectable="true" />
  <enemy stamina="5" skill="5" id="34" name="Piranhák" resurrectable="true" />
  <enemy stamina="6" skill="7" id="35" name="Kutya" />
  <enemy stamina="8" skill="8" id="36" name="Farkasember" />
  <enemy stamina="5" skill="7" id="37" name="A Csontvázak Vezére" />
  <enemy stamina="5" skill="6" id="38" name="Első Csontváz" />
  <enemy stamina="6" skill="6" id="39" name="Második Csontváz" />
  <enemy stamina="6" skill="5" id="40" name="Harmadik Csontváz" />
  <enemy stamina="5" skill="5" id="41" name="Negyedik Csontváz" />
  <enemy stamina="5" skill="5" id="42" name="Harmadik Csontváz" />
  <enemy stamina="6" skill="9" id="43" name="Lidérc" killableByNormal="false" killableByMagical="false" />
  <enemy stamina="6" skill="7" id="44" name="Zombi" />
  <enemy stamina="6" skill="6" id="45" name="Zombi kaszával" />
  <enemy stamina="6" skill="6" id="46" name="Zombi csákánnyal" />
  <enemy stamina="5" skill="6" id="47" name="Zombi bárddal" />
  <enemy stamina="10" skill="10" id="48" name="Vámpír" />
  <enemy stamina="7" skill="8" id="49" name="Ghoul" />
  <enemy stamina="4" skill="7" id="50" name="Első Törpe" />
  <enemy stamina="6" skill="6" id="51" name="Második Törpe" />
  <enemy stamina="5" skill="7" id="52" name="Harmadik Törpe" />
  <enemy stamina="5" skill="7" id="53" name="Negyedik Törpe" />
  <enemy stamina="9" skill="9" id="54" name="Minotaurusz" />
  <enemy stamina="12" skill="10" id="55" name="Sárkány" />
  <enemy stamina="18" skill="11" id="56" name="Varázsló" />
  <enemy stamina="12" skill="7" id="57" name="Varázsló" />
  <enemy stamina="18" skill="11" id="58" name="Varázsló" damageAbsorption="-1" />



  <enemy stamina="3" skill="5" id="91" name="Goblin" resurrectable="true" />
  <enemy stamina="3" skill="6" id="92" name="Ork" resurrectable="true" />
  <enemy stamina="4" skill="6" id="93" name="Gremlin" resurrectable="true" />
  <enemy stamina="4" skill="5" id="94" name="Óriás Patkány" resurrectable="true" />
  <enemy stamina="5" skill="6" id="95" name="Csontváz" resurrectable="true" />
  <enemy stamina="4" skill="8" id="96" name="Troll" resurrectable="true" />




</enemies>
