<?xml version="1.0" encoding="utf-8" ?>
<enemies xmlns="http://gamebooks.zagor.hu" xmlns:xsi="http://www.w3.org/2001/XMLSchema-instance" xsi:schemaLocation="http://gamebooks.zagor.hu http://zagor.hu/xsd/ff-enemies.xsd">
  <enemy id="1" name="Csonttörő" skill="9" stamina="10" />
  <enemy id="2" name="Keleti Ember" skill="10" stamina="8" />
  <enemy name="Rabszolga" id="3" stamina="8" skill="9" />
  <enemy name="Küzdő Rabszolga" id="4" stamina="8" skill="8" />
  <enemy name="Délvidéki Ember" id="5" stamina="10" skill="10" />
  <enemy name="Pokolkutya" id="6" stamina="6" skill="7" />
  <enemy name="Lopakodó" id="7" stamina="6" skill="6" />
  <enemy name="Első Vámpír Denevér" id="8" stamina="5" skill="5" staminaDamageWhileInactive="1" />
  <enemy name="Második Vámpír Denevér" id="9" stamina="4" skill="5" staminaDamageWhileInactive="1" />
  <enemy name="Hidegkarom" id="10" stamina="11" skill="10" />
  <enemy name="Csontördög" id="11" stamina="8" skill="10" />
  <enemy name="Első Ork" id="12" stamina="5" skill="6" />
  <enemy name="Második Ork" id="13" stamina="6" skill="6" />
  <enemy name="Mutáns Ork" id="14" stamina="7" skill="7" />
  <enemy name="Óriáspók" id="15" stamina="8" skill="7" />
  <enemy name="Első Patkány" id="16" stamina="2" skill="3" />
  <enemy name="Második Patkány" id="17" stamina="2" skill="2" />
  <enemy name="Harmadik Patkány" id="18" stamina="2" skill="3" />
  <enemy name="Negyedik Patkány" id="19" stamina="2" skill="3" />
  <enemy name="Ötödik Patkány" id="20" stamina="2" skill="4" />
  <enemy name="Lícs Királynő" id="21" stamina="9" skill="9" />
  <enemy name="Óriás Százlábú" id="22" stamina="7" skill="9" />
  <enemy name="Barlangi Ember" id="23" stamina="10" skill="7" staminaDamage="0" damageAbsorption="3" />
  <enemy name="Csontváz Király" id="24" stamina="7" skill="9" damageAbsorptionEdged="1" />
  <enemy name="Vérféreg" id="25a" stamina="6" skill="4" staminaAutoDamage="2" />
  <enemy name="Vérféreg" id="25b" stamina="6" skill="4" />
  <enemy name="Xoroa Harcos" id="26" stamina="11" skill="10" />
  <enemy name="Kétfejű Kutya, Első Fej" commonName="Kétfejű Kutya" id="27a" stamina="5" skill="6" />
  <enemy name="Kétfejű Kutya, Második Fej" commonName="Kétfejű Kutya" id="27b" stamina="5" skill="6" />
  <enemy name="Agyaras" id="28" stamina="6" skill="6" />
  <enemy name="Káoszbajnok" id="29a" stamina="12" skill="11" />
  <enemy name="Káoszbajnok" id="29b" stamina="10" skill="11" />
  <enemy name="Első Xoroa Harcos" id="30" stamina="10" skill="10" />
  <enemy name="Második Xoroa Harcos" id="31" stamina="11" skill="9" />
  <enemy name="Harmadik Xoroa Harcos" id="32" stamina="11" skill="10" />
  <enemy name="Negyedik Xoroa Harcos" id="33" stamina="10" skill="10" />
  <enemy name="Nyelv" id="34" stamina="6" skill="5" />
  <enemy name="Tentallus" id="35" stamina="12" skill="8" />
  <enemy name="Bálvány" id="36" stamina="6" skill="9" killableByNormal="false" />
  <enemy name="Dombi Troll" id="37" stamina="10" skill="9" />
  <enemy name="Keleti Hadúr" id="38" stamina="9" skill="10" />
  <enemy name="Tűzördög" id="39" stamina="4" skill="9" />
  <enemy name="Tűzdémon" id="40" stamina="10" skill="10" />
  <enemy name="Lord Carnuss" id="41" stamina="10" skill="10" />

</enemies>
