<?xml version="1.0" encoding="utf-8" ?>
<enemies xmlns="http://gamebooks.zagor.hu" xmlns:xsi="http://www.w3.org/2001/XMLSchema-instance" xsi:schemaLocation="http://gamebooks.zagor.hu http://zagor.hu/xsd/ff-enemies.xsd">
  <enemy stamina="9" skill="8" id="1" name="Fehér Nőstényfarkas" />
  <enemy stamina="9" skill="8" id="2" name="Grendel" />
  <enemy stamina="6" skill="5" id="3" name="Első Ork" />
  <enemy stamina="4" skill="5" id="4" name="Második Ork" />
  <enemy stamina="7" skill="7" id="5" name="Ork Vezér" />
  <enemy stamina="20" skill="8" id="6" name="Gyilkos Fűz" />
  <enemy stamina="10" skill="8" id="7" name="Kapitány" />
  <enemy stamina="8" skill="6" id="8" name="Elvira" />
  <enemy stamina="8" skill="7" id="9" name="Láthatatlan Támadó" />
  <enemy stamina="15" skill="10" id="10" name="Halállovag" />

</enemies>
