<?xml version="1.0" encoding="utf-8" ?>
<enemies xmlns="http://gamebooks.zagor.hu" xmlns:xsi="http://www.w3.org/2001/XMLSchema-instance" xsi:schemaLocation="http://gamebooks.zagor.hu http://zagor.hu/xsd/ff-enemies.xsd">
  <enemy stamina="6" skill="7" id="1" name="Bűzös Borz" />
  <enemy stamina="11" skill="9" id="2" name="Madárember" />
  <enemy stamina="7" skill="7" id="3" name="Farkas" />
  <enemy stamina="2" skill="7" id="4" name="Őr" />
  <enemy stamina="6" skill="8" id="5" name="Második Őr" />
  <enemy stamina="7" skill="7" id="6" name="Első Őr" />
  <enemy stamina="7" skill="6" id="7" name="Második Őr" />
  <enemy stamina="8" skill="7" id="8" name="Harmadik Őr" />
  <enemy stamina="7" skill="8" id="9" name="Negyedik Őr" />
  <enemy stamina="6" skill="7" id="10" name="Első Fekete Elf" />
  <enemy stamina="7" skill="7" id="11" name="Második Fekete Elf" />
  <enemy stamina="6" skill="6" id="12" name="Harmadik Fekete Elf" />
  <enemy stamina="6" skill="8" id="13" name="Első Őr" />
  <enemy stamina="7" skill="7" id="14" name="Második Őr" />
  <enemy stamina="6" skill="8" id="15" name="Őr" />

</enemies>
