<?xml version="1.0" encoding="utf-8" ?>
<enemies xmlns="http://gamebooks.zagor.hu" xmlns:xsi="http://www.w3.org/2001/XMLSchema-instance" xsi:schemaLocation="http://gamebooks.zagor.hu http://zagor.hu/xsd/ff-enemies.xsd">
  <enemy stamina="6" skill="6" id="1" name="Első Csáp" />
  <enemy stamina="6" skill="6" id="2" name="Második Csáp" />
  <enemy stamina="6" skill="6" id="3" name="Harmadik Csáp" />
  <enemy stamina="6" skill="6" id="4" name="Negyedik Csáp" />
  <enemy stamina="6" skill="6" id="5" name="Ötödik Csáp" />
  <enemy stamina="10" skill="6" id="6" name="Első Feketeszívű" />
  <enemy stamina="10" skill="7" id="7" name="Második Feketeszívű" />
  <enemy stamina="8" skill="6" id="8" name="Első Spriggen" />
  <enemy stamina="8" skill="7" id="9" name="Második Spriggen" />
  <enemy stamina="10" skill="7" id="10" name="Erdei Elf-főnök" />
  <enemy stamina="12" skill="9" id="11" name="Lidérc" />
  <enemy stamina="12" skill="5" id="12" name="Denevérek" />
  <enemy stamina="11" skill="9" id="13" name="Nandi-medve" />
  <enemy stamina="10" skill="9" id="14" name="Doragar" />
  <enemy stamina="6" skill="5" id="15" name="Élősködők" />
  <enemy stamina="8" skill="7" id="16" name="Törpe Ork" fleeAtRound="2" />
  <enemy stamina="10" skill="6" id="17" name="Törpe Ork" fleeAtRound="5" />
  <enemy stamina="8" skill="5" id="18" name="Második Törpe Ork" />
  <enemy stamina="10" skill="6" id="19" name="Első Törpe Ork" />
  <enemy stamina="12" skill="9" id="20" name="Pokoltűz Szellem" />
  <enemy stamina="12" skill="11" id="21" name="Kardfogú Tigris" fleeAtRound="4" />
  <enemy stamina="4" skill="4" id="22" name="Köpködő Vipera" />
  <enemy stamina="8" skill="5" id="23" name="Első Csontváz" />
  <enemy stamina="8" skill="5" id="24" name="Második Csontváz" />
  <enemy stamina="6" skill="7" id="25" name="Árnyékszörny" damageAbsorption="1" />
  <enemy stamina="8" skill="6" id="26" name="Vadmacska" />
  <enemy stamina="8" skill="5" id="27" name="Első Mordida" />
  <enemy stamina="10" skill="7" id="28" name="Második Mordida" />
  <enemy stamina="11" skill="9" id="29" name="Dombi Óriás" />
  <enemy stamina="12" skill="7" id="30" name="Óriás Vérsólyom" />
  <enemy stamina="14" skill="6" id="31" name="Vérszívó Pók" />
  <enemy stamina="8" skill="7" id="32" name="Aligátor" />
  <enemy stamina="10" skill="7" id="33" name="Aligátor" />
  <enemy stamina="6" skill="7" id="34" name="Kiméra" staminaDamage="2" staminaAutoDamage="1" />
  <enemy stamina="10" skill="8" id="35" name="Első Törzsi Harcos" />
  <enemy stamina="12" skill="7" id="36" name="Második Törzsi Harcos" />
  <enemy stamina="12" skill="6" id="37" name="Hóbocs" fleeAtStamina="11" />
  <enemy stamina="10" skill="10" id="38" name="Jégsárkány" />
  <enemy stamina="14" skill="10" id="39" name="Jégsárkány" />
  <enemy stamina="13" skill="7" id="40" name="Chion" />
  <enemy stamina="8" skill="7" id="41" name="Kezek" />
  <enemy stamina="6" skill="11" id="42" name="Morgana" damageAbsorption="1" />
  <enemy stamina="10" skill="8" id="43" name="Ifor Tynin" />
  <enemy stamina="10" skill="8" id="44" name="Első Törzsi Harcos" />
  <enemy stamina="12" skill="7" id="45" name="Második Törzsi Harcos" />
  <enemy stamina="6" skill="6" id="46" name="Első Csáp" />
  <enemy stamina="6" skill="6" id="47" name="Második Csáp" />
  <enemy stamina="6" skill="6" id="48" name="Harmadik Csáp" />
  <enemy stamina="6" skill="6" id="49" name="Negyedik Csáp" />
  <enemy stamina="6" skill="6" id="50" name="Ötödik Csáp" />







</enemies>
