<?xml version="1.0" encoding="utf-8" ?>
<enemies xmlns="http://gamebooks.zagor.hu" xmlns:xsi="http://www.w3.org/2001/XMLSchema-instance" xsi:schemaLocation="http://gamebooks.zagor.hu http://zagor.hu/xsd/ff-enemies.xsd">
  <enemy name="Púpos" id="1" stamina="7" skill="7" fleeAtStamina="4" />
  <enemy name="Zombi" id="2" stamina="6" skill="7" />
  <enemy name="Láthatatlan ellenfél" id="3" stamina="4" skill="10" />
  <enemy name="Első Zombi" id="4" stamina="6" skill="7" />
  <enemy name="Második Zombi" id="5" stamina="6" skill="6" />
  <enemy name="Fehér hajú férfi" id="6" stamina="9" skill="7" />
  <enemy name="Vezér" id="7" stamina="9" skill="8" />
  <enemy name="Az Úr szolgálója" id="10" stamina="9" skill="8" />
  <enemy name="Első férfi" id="11" stamina="8" skill="7" />
  <enemy name="Második férfi" id="12" stamina="9" skill="8" />
  <enemy name="Fehér köntöst viselő mester" id="13" stamina="9" skill="7" fleeAtStamina="2" />
  <enemy name="Púpos" id="14" stamina="7" skill="7" fleeAtStamina="6" />
  <enemy name="Első Tűzmanó" id="15" stamina="4" skill="7" staminaDamage="3" />
  <enemy name="Második Tűzma" id="16" stamina="3" skill="7" staminaDamage="3" />
  <enemy name="Ghoul" id="17" stamina="7" skill="8" />
  <enemy name="Púpos" id="18" stamina="7" skill="7" />
  <enemy name="Púpos" id="19" stamina="7" skill="7" />
  <enemy name="Dán dog" id="20" stamina="5" skill="7" />
  <enemy name="Második Dán dog" id="21" stamina="6" skill="6" />
  <enemy name="Harmadik Dán dog" id="22" stamina="5" skill="6" />
  <enemy name="Első Dán dog" id="23" stamina="6" skill="7" />
  <enemy name="Második Dán dog" id="24" stamina="6" skill="6" />
  <enemy name="Denevérek" id="25" stamina="4" skill="4" />
  <enemy name="Ghoul" id="26" stamina="7" skill="8" />
  <enemy name="Első Csontváz" id="27" stamina="6" skill="6" />
  <enemy name="Második Csontváz" id="28" stamina="6" skill="7" />
  <enemy name="Az Ördög híve" id="29" stamina="7" skill="8" />
  <enemy name="Drumer grófja" id="30" stamina="10" skill="9" />
  <enemy name="Franklins" id="31" stamina="8" skill="8" />
  <enemy name="Pokoldémon" id="32" stamina="12" skill="14" killableByNormal="false" />

</enemies>
